16:54:13.233924 IP host142.50936 > host142.http: Flags [S], seq 3324757624, win 43690, options [mss 65495,sackOK,TS val 138010617 ecr 0,nop,wscale 7], length 0
E..<..@.@.r............P.+.x...................
.9..........
21:04:48.908984 IP host142.http > host142.50936: Flags [S.], seq 1140472287, ack 3324757625, win 43690, options [mss 65495,sackOK,TS val 138010617 ecr 138010617,nop,wscale 7], length 0
E..<..@.@..N.........P..C.9..+.y...............
.9...9......
16:54:13.233970 IP host142.50936 > host142.http: Flags [.], ack 1, win 342, options [nop,nop,TS val 138010617 ecr 138010617], length 0
E..4..@.@.r............P.+.yC.9....V.......
.9...9..
16:54:13.234401 IP host142.50936 > host142.http: Flags [P.], seq 1:439, ack 1, win 342, options [nop,nop,TS val 138010617 ecr 138010617], length 438
E.....@.@.q............P.+.yC.9....V.J.....
.9...9..POST /BUCKET-mygod/testxxx?uploads HTTP/1.1
Host: host142
Accept-Encoding: identity
Content-Length: 0
x-amz-meta-s3cmd-attrs: uid:0/gname:root/uname:root/gid:0/mode:33188/mtime:1487115241/atime:1487144824/md5:0007a3572dde70275cd8fd8ce62ef78c/ctime:1487144821
content-type: text/plain
Authorization: AWS XN6QBMRYUE5H49KNVT1D:pgzGGiOgf6/KbXq1Sug6DywKT+Y=
x-amz-date: Wed, 15 Feb 2017 08:54:13 +0000
x-amz-storage-class: STANDARD


16:54:13.234416 IP host142.http > host142.50936: Flags [.], ack 439, win 350, options [nop,nop,TS val 138010617 ecr 138010617], length 0
E..4..@.@..<.........P..C.9..+./...^.......
.9...9..
16:54:13.246363 IP host142.http > host142.50936: Flags [P.], seq 1:176, ack 439, win 350, options [nop,nop,TS val 138010629 ecr 138010617], length 175
E.....@.@............P..C.9..+./...^.C.....
.9...9..HTTP/1.1 200 OK
x-amz-request-id: tx00000000000000000196c-0058a41735-1045-default
Content-Type: application/xml
Content-Length: 250
Date: Wed, 15 Feb 2017 08:54:13 GMT


16:54:13.246376 IP host142.50936 > host142.http: Flags [.], ack 176, win 350, options [nop,nop,TS val 138010629 ecr 138010629], length 0
E..4..@.@.r............P.+./C.:....^.......
.9...9..
16:54:13.246390 IP host142.http > host142.50936: Flags [P.], seq 176:426, ack 439, win 350, options [nop,nop,TS val 138010629 ecr 138010629], length 250
E.....@.@..@.........P..C.:..+./...^.......
.9...9..<?xml version="1.0" encoding="UTF-8"?><InitiateMultipartUploadResult xmlns="http://s3.amazonaws.com/doc/2006-03-01/"><Bucket>BUCKET-mygod</Bucket><Key>testxxx</Key><UploadId>2~tv3Z24qxcuOdyq8YC2lPG-9982Aj9Ot</UploadId></InitiateMultipartUploadResult>
16:54:13.246398 IP host142.50936 > host142.http: Flags [.], ack 426, win 359, options [nop,nop,TS val 138010629 ecr 138010629], length 0
E..4..@.@.r............P.+./C.;....g.......
.9...9..
16:54:13.478434 IP host142.50936 > host142.http: Flags [P.], seq 439:716, ack 426, win 359, options [nop,nop,TS val 138010860 ecr 138010629], length 277
E..I..@.@.q............P.+./C.;....g.......
.9...9..PUT /BUCKET-mygod/testxxx?partNumber=1&uploadId=2~tv3Z24qxcuOdyq8YC2lPG-9982Aj9Ot HTTP/1.1
Host: host142
Accept-Encoding: identity
Authorization: AWS XN6QBMRYUE5H49KNVT1D:DCTWbBsBPtOFHk0Z2fbrUWM6jUw=
content-length: 15728640
x-amz-date: Wed, 15 Feb 2017 08:54:13 +0000


16:54:13.478946 IP host142.50936 > host142.http: Flags [.], seq 716:23116, ack 426, win 359, options [nop,nop,TS val 138010860 ecr 138010629], length 22400
E.W...@.@..O...........P.+.DC.;....g.......
16:54:13.479596 IP host142.http > host142.50936: Flags [.], ack 23116, win 1382, options [nop,nop,TS val 138010863 ecr 138010860], length 0
E..4..@.@..9.........P..C.;.., ....f.......
.9...9..
16:54:13.479621 IP host142.50936 > host142.http: Flags [P.], seq 23116:37580, ack 426, win 359, options [nop,nop,TS val 138010863 ecr 138010863], length 14464
E.8...@.@.:N...........P., .C.;....g.......
16:54:13.483173 IP host142.50936 > host142.http: Flags [.], seq 37580:103048, ack 426, win 359, options [nop,nop,TS val 138010865 ecr 138010863], length 65468
E.....@.@.s............P.,YDC.;....g.Q.....
16:54:13.484699 IP host142.50936 > host142.http: Flags [.], seq 103048:168516, ack 426, win 359, options [nop,nop,TS val 138010868 ecr 138010863], length 65468
E.....@.@.s............P.-Y.C.;....g.Q.....
16:54:13.486698 IP host142.http > host142.50936: Flags [.], ack 103048, win 3428, options [nop,nop,TS val 138010870 ecr 138010863], length 0
E..4..@.@..8.........P..C.;..-Y...d.......
.9...9..
16:54:13.486759 IP host142.50936 > host142.http: Flags [.], seq 168516:233984, ack 426, win 359, options [nop,nop,TS val 138010870 ecr 138010870], length 65468
E.....@.@.s............P..X.C.;....g.Q.....
16:54:13.486772 IP host142.50936 > host142.http: Flags [P.], seq 233984:271052, ack 426, win 359, options [nop,nop,TS val 138010870 ecr 138010870], length 37068
E.....@.@..............P./XxC.;....g?a.....
16:54:13.486869 IP host142.http > host142.50936: Flags [.], ack 233984, win 3635, options [nop,nop,TS val 138010870 ecr 138010868], length 0
E..4..@.@..7.........P..C.;../Xx...3.......
.9...9..
16:54:13.493320 IP host142.50936 > host142.http: Flags [.], seq 271052:336520, ack 426, win 359, options [nop,nop,TS val 138010875 ecr 138010870], length 65468
E.....@.@.s............P./.DC.;....g.Q.....
16:54:13.494451 IP host142.50936 > host142.http: Flags [.], seq 336520:401988, ack 426, win 359, options [nop,nop,TS val 138010877 ecr 138010870], length 65468
E.....@.@.s............P.0..C.;....g.Q.....
16:54:13.495283 IP host142.50936 > host142.http: Flags [.], seq 401988:467456, ack 426, win 359, options [nop,nop,TS val 138010877 ecr 138010870], length 65468
E.....@.@.s
...........P.1..C.;....g.Q.....
16:54:13.496334 IP host142.50936 > host142.http: Flags [.], seq 467456:532924, ack 426, win 359, options [nop,nop,TS val 138010877 ecr 138010870], length 65468
E.....@.@.s	...........P.2.xC.;....g.Q.....
16:54:13.497218 IP host142.50936 > host142.http: Flags [.], seq 532924:598392, ack 426, win 359, options [nop,nop,TS val 138010880 ecr 138010870], length 65468
E.....@.@.s............P.3.4C.;....g.Q.....
16:54:13.498065 IP host142.50936 > host142.http: Flags [.], seq 598392:663860, ack 426, win 359, options [nop,nop,TS val 138010880 ecr 138010870], length 65468
E.....@.@.s............P.4..C.;....g.Q.....
16:54:13.498883 IP host142.http > host142.50936: Flags [.], ack 336520, win 3635, options [nop,nop,TS val 138010882 ecr 138010870], length 0
E..4..@.@..6.........P..C.;..0.....3.......
.9...9..
16:54:13.498909 IP host142.50936 > host142.http: Flags [P.], seq 663860:701132, ack 426, win 359, options [nop,nop,TS val 138010882 ecr 138010882], length 37272
E.....@.@..*...........P.5..C.;....g@-.....
16:54:13.498995 IP host142.http > host142.50936: Flags [.], ack 467456, win 5682, options [nop,nop,TS val 138010882 ecr 138010877], length 0
E..4. @.@..5.........P..C.;..2.x...2.......
.9...9..
16:54:13.499021 IP host142.http > host142.50936: Flags [.], ack 598392, win 7728, options [nop,nop,TS val 138010882 ecr 138010877], length 0
E..4.!@.@..4.........P..C.;..4.....0.......
.9...9..
16:54:13.499030 IP host142.http > host142.50936: Flags [.], ack 701132, win 9774, options [nop,nop,TS val 138010882 ecr 138010880], length 0
E..4."@.@..3.........P..C.;..6yD..&........
.9...9..
16:54:13.514316 IP host142.50936 > host142.http: Flags [P.], seq 701132:705228, ack 426, win 359, options [nop,nop,TS val 138010897 ecr 138010882], length 4096
E..4..@.@.b............P.6yDC.;....g.......
16:54:13.515167 IP host142.50936 > host142.http: Flags [.], seq 705228:770696, ack 426, win 359, options [nop,nop,TS val 138010897 ecr 138010882], length 65468
E.....@.@.s............P.6.DC.;....g.Q.....
16:54:13.516353 IP host142.50936 > host142.http: Flags [.], seq 770696:836164, ack 426, win 359, options [nop,nop,TS val 138010899 ecr 138010882], length 65468
E.....@.@.s............P.7..C.;....g.Q.....
16:54:13.517176 IP host142.50936 > host142.http: Flags [.], seq 836164:901632, ack 426, win 359, options [nop,nop,TS val 138010899 ecr 138010882], length 65468
E.....@.@.s............P.8..C.;....g.Q.....
16:54:13.518157 IP host142.http > host142.50936: Flags [.], ack 770696, win 11821, options [nop,nop,TS val 138010901 ecr 138010897], length 0
E..4.#@.@..2.........P..C.;..7.....-.......
.9...9..
16:54:13.518188 IP host142.50936 > host142.http: Flags [P.], seq 901632:959180, ack 426, win 359, options [nop,nop,TS val 138010901 ecr 138010901], length 57548
E.....@.@..............P.9.xC.;....g.a.....
16:54:13.518218 IP host142.http > host142.50936: Flags [.], ack 901632, win 13867, options [nop,nop,TS val 138010901 ecr 138010899], length 0
E..4.$@.@..1.........P..C.;..9.x..6+.......
.9...9..
16:54:13.523164 IP host142.50936 > host142.http: Flags [.], seq 959180:1024648, ack 426, win 359, options [nop,nop,TS val 138010906 ecr 138010901], length 65468
E.....@.@.s............P.:iDC.;....g.Q.....
16:54:13.524005 IP host142.50936 > host142.http: Flags [.], seq 1024648:1090116, ack 426, win 359, options [nop,nop,TS val 138010906 ecr 138010901], length 65468
E.....@.@.r............P.;i.C.;....g.Q.....
16:54:13.524834 IP host142.50936 > host142.http: Flags [.], seq 1090116:1155584, ack 426, win 359, options [nop,nop,TS val 138010906 ecr 138010901], length 65468
E.....@.@.r............P.<h.C.;....g.Q.....
16:54:13.525529 IP host142.http > host142.50936: Flags [.], ack 1024648, win 15913, options [nop,nop,TS val 138010909 ecr 138010901], length 0
E..4.%@.@..0.........P..C.;..;i...>).......
.9...9..
16:54:13.525566 IP host142.http > host142.50936: Flags [.], ack 1155584, win 17960, options [nop,nop,TS val 138010909 ecr 138010906], length 0
E..4.&@.@../.........P..C.;..=hx..F(.......
.9...9..
16:54:13.525581 IP host142.50936 > host142.http: Flags [P.], seq 1155584:1176268, ack 426, win 359, options [nop,nop,TS val 138010909 ecr 138010909], length 20684
E.Q...@.@.!............P.=hxC.;....g.`.....
16:54:13.532145 IP host142.50936 > host142.http: Flags [.], seq 1176268:1241736, ack 426, win 359, options [nop,nop,TS val 138010914 ecr 138010909], length 65468
E.....@.@.r............P.=.DC.;....g.Q.....
16:54:13.533655 IP host142.50936 > host142.http: Flags [.], seq 1241736:1307204, ack 426, win 359, options [nop,nop,TS val 138010916 ecr 138010909], length 65468
E.....@.@.r............P.>..C.;....g.Q.....
16:54:13.534484 IP host142.50936 > host142.http: Flags [.], seq 1307204:1372672, ack 426, win 359, options [nop,nop,TS val 138010916 ecr 138010909], length 65468
E.....@.@.r............P.?..C.;....g.Q.....
16:54:13.539672 IP host142.http > host142.50936: Flags [.], ack 1241736, win 20006, options [nop,nop,TS val 138010921 ecr 138010909], length 0
E..4.'@.@............P..C.;..>....N&.......
.9.).9..
16:54:13.539970 IP host142.50936 > host142.http: Flags [P.], seq 1372672:1397452, ack 426, win 359, options [nop,nop,TS val 138010923 ecr 138010921], length 24780
E.a...@.@..............P.@.xC.;....g.a.....
16:54:13.539994 IP host142.http > host142.50936: Flags [.], ack 1372672, win 22052, options [nop,nop,TS val 138010923 ecr 138010916], length 0
E..4.(@.@..-.........P..C.;..@.x..V$.......
.9.+.9.$
16:54:13.543971 IP host142.50936 > host142.http: Flags [.], seq 1397452:1462920, ack 426, win 359, options [nop,nop,TS val 138010926 ecr 138010923], length 65468
E.....@.@.r............P.A.DC.;....g.Q.....
16:54:13.544760 IP host142.http > host142.50936: Flags [.], ack 1462920, win 24099, options [nop,nop,TS val 138010928 ecr 138010923], length 0
E..4.)@.@..,.........P..C.;..B....^#.......
.9.0.9.+
16:54:13.544796 IP host142.50936 > host142.http: Flags [P.], seq 1462920:1503948, ack 426, win 359, options [nop,nop,TS val 138010928 ecr 138010928], length 41028
E..x..@.@..o...........P.B..C.;....gN......
16:54:13.547279 IP host142.50936 > host142.http: Flags [.], seq 1503948:1569416, ack 426, win 359, options [nop,nop,TS val 138010930 ecr 138010928], length 65468
E.....@.@.r............P.B.DC.;....g.Q.....
16:54:13.548409 IP host142.50936 > host142.http: Flags [.], seq 1569416:1634884, ack 426, win 359, options [nop,nop,TS val 138010930 ecr 138010928], length 65468
E.....@.@.r............P.C..C.;....g.Q.....
16:54:13.549755 IP host142.50936 > host142.http: Flags [.], seq 1634884:1700352, ack 426, win 359, options [nop,nop,TS val 138010933 ecr 138010928], length 65468
E.....@.@.r............P.D..C.;....g.Q.....
16:54:13.550847 IP host142.50936 > host142.http: Flags [.], seq 1700352:1765820, ack 426, win 359, options [nop,nop,TS val 138010933 ecr 138010928], length 65468
E.....@.@.r............P.E.xC.;....g.Q.....
16:54:13.552066 IP host142.http > host142.50936: Flags [.], ack 1569416, win 24576, options [nop,nop,TS val 138010935 ecr 138010928], length 0
E..4.*@.@..+.........P..C.;..C....`........
.9.7.9.0
16:54:13.552106 IP host142.50936 > host142.http: Flags [P.], seq 1765820:1823436, ack 426, win 359, options [nop,nop,TS val 138010935 ecr 138010935], length 57616
E..D..@.@..............P.F.4C.;....g.......
16:54:13.552120 IP host142.http > host142.50936: Flags [.], ack 1765820, win 23799, options [nop,nop,TS val 138010935 ecr 138010930], length 0
E..4.+@.@..*.........P..C.;..F.4..\........
.9.7.9.2
16:54:13.570854 IP host142.50936 > host142.http: Flags [.], seq 1823436:1888904, ack 426, win 359, options [nop,nop,TS val 138010953 ecr 138010935], length 65468
E.....@.@.r............P.G.DC.;....g.Q.....
16:54:13.572634 IP host142.50936 > host142.http: Flags [.], seq 1888904:1954372, ack 426, win 359, options [nop,nop,TS val 138010955 ecr 138010935], length 65468
E.....@.@.r............P.H..C.;....g.Q.....
16:54:13.573433 IP host142.50936 > host142.http: Flags [.], seq 1954372:2019840, ack 426, win 359, options [nop,nop,TS val 138010955 ecr 138010935], length 65468
E.....@.@.r............P.I..C.;....g.Q.....
16:54:13.573799 IP host142.http > host142.50936: Flags [.], ack 1888904, win 24576, options [nop,nop,TS val 138010957 ecr 138010935], length 0
E..4.,@.@..).........P..C.;..H....`........
.9.M.9.7
16:54:13.573818 IP host142.50936 > host142.http: Flags [P.], seq 2019840:2028236, ack 426, win 359, options [nop,nop,TS val 138010957 ecr 138010957], length 8396
E.!...@.@.Q............P.J.xC.;....g.`.....
16:54:13.573847 IP host142.http > host142.50936: Flags [.], ack 2019840, win 24576, options [nop,nop,TS val 138010957 ecr 138010955], length 0
E..4.-@.@..(.........P..C.;..J.x..`........
.9.M.9.K
16:54:13.578083 IP host142.50936 > host142.http: Flags [.], seq 2028236:2093704, ack 426, win 359, options [nop,nop,TS val 138010960 ecr 138010957], length 65468
E.....@.@.r............P.J.DC.;....g.Q.....
16:54:13.579103 IP host142.50936 > host142.http: Flags [.], seq 2093704:2159172, ack 426, win 359, options [nop,nop,TS val 138010962 ecr 138010957], length 65468
E.....@.@.r............P.K..C.;....g.Q.....
16:54:13.580559 IP host142.50936 > host142.http: Flags [.], seq 2159172:2224640, ack 426, win 359, options [nop,nop,TS val 138010963 ecr 138010957], length 65468
E.....@.@.r............P.L..C.;....g.Q.....
16:54:13.581178 IP host142.http > host142.50936: Flags [.], ack 2093704, win 24576, options [nop,nop,TS val 138010964 ecr 138010957], length 0
E..4..@.@..'.........P..C.;..K....`........
.9.T.9.M
16:54:13.581205 IP host142.50936 > host142.http: Flags [P.], seq 2224640:2245324, ack 426, win 359, options [nop,nop,TS val 138010964 ecr 138010964], length 20684
E.Q...@.@.!............P.M.xC.;....g.`.....
16:54:13.581214 IP host142.http > host142.50936: Flags [.], ack 2224640, win 24058, options [nop,nop,TS val 138010964 ecr 138010962], length 0
E..4./@.@..&.........P..C.;..M.x..]........
.9.T.9.R
16:54:13.587466 IP host142.50936 > host142.http: Flags [.], seq 2245324:2310792, ack 426, win 359, options [nop,nop,TS val 138010969 ecr 138010964], length 65468
E.....@.@.r............P.N	DC.;....g.Q.....
16:54:13.588500 IP host142.50936 > host142.http: Flags [.], seq 2310792:2376260, ack 426, win 359, options [nop,nop,TS val 138010972 ecr 138010964], length 65468
E.....@.@.r............P.O	.C.;....g.Q.....
16:54:13.589303 IP host142.50936 > host142.http: Flags [.], seq 2376260:2441728, ack 426, win 359, options [nop,nop,TS val 138010972 ecr 138010964], length 65468
E.....@.@.r............P.P..C.;....g.Q.....
16:54:13.590110 IP host142.50936 > host142.http: Flags [.], seq 2441728:2507196, ack 426, win 359, options [nop,nop,TS val 138010972 ecr 138010964], length 65468
E.....@.@.r............P.Q.xC.;....g.Q.....
16:54:13.597370 IP host142.http > host142.50936: Flags [.], ack 2310792, win 24576, options [nop,nop,TS val 138010979 ecr 138010964], length 0
E..4.0@.@..%.........P..C.;..O	...`........
.9.c.9.T
16:54:13.597397 IP host142.50936 > host142.http: Flags [P.], seq 2507196:2540236, ack 426, win 359, options [nop,nop,TS val 138010979 ecr 138010979], length 33040
E..D..@.@..............P.R.4C.;....g/......
16:54:13.597432 IP host142.http > host142.50936: Flags [.], ack 2441728, win 24576, options [nop,nop,TS val 138010979 ecr 138010972], length 0
E..4.1@.@..$.........P..C.;..Q.x..`........
.9.c.9.\
16:54:13.597464 IP host142.http > host142.50936: Flags [.], ack 2540236, win 24576, options [nop,nop,TS val 138010979 ecr 138010972], length 0
E..4.2@.@..#.........P..C.;..R.D..`........
.9.c.9.\
16:54:13.605064 IP host142.50936 > host142.http: Flags [P.], seq 2540236:2544332, ack 426, win 359, options [nop,nop,TS val 138010986 ecr 138010979], length 4096
E..4..@.@.b............P.R.DC.;....g.......
16:54:13.606476 IP host142.50936 > host142.http: Flags [.], seq 2544332:2609800, ack 426, win 359, options [nop,nop,TS val 138010989 ecr 138010979], length 65468
E.....@.@.r............P.R.DC.;....g.Q.....
16:54:13.607765 IP host142.http > host142.50936: Flags [.], ack 2609800, win 24576, options [nop,nop,TS val 138010991 ecr 138010986], length 0
E..4.3@.@..".........P..C.;..S....`........
.9.o.9.j
16:54:13.607807 IP host142.50936 > host142.http: Flags [P.], seq 2609800:2667212, ack 426, win 359, options [nop,nop,TS val 138010991 ecr 138010991], length 57412
E..x..@.@..Z...........P.S..C.;....g.......
16:54:13.613261 IP host142.50936 > host142.http: Flags [.], seq 2667212:2732680, ack 426, win 359, options [nop,nop,TS val 138010996 ecr 138010991], length 65468
E.....@.@.r............P.TyDC.;....g.Q.....
16:54:13.614182 IP host142.50936 > host142.http: Flags [.], seq 2732680:2798148, ack 426, win 359, options [nop,nop,TS val 138010996 ecr 138010991], length 65468
E.....@.@.r............P.Uy.C.;....g.Q.....
16:54:13.624881 IP host142.http > host142.50936: Flags [.], ack 2732680, win 24576, options [nop,nop,TS val 138011008 ecr 138010991], length 0
E..4.4@.@..!.........P..C.;..Uy...`........
.9...9.o
16:54:13.624923 IP host142.50936 > host142.http: Flags [P.], seq 2798148:2847436, ack 426, win 359, options [nop,nop,TS val 138011008 ecr 138011008], length 49288
E.....@.@..............P.Vx.C.;....go......
16:54:13.624966 IP host142.http > host142.50936: Flags [.], ack 2847436, win 24576, options [nop,nop,TS val 138011008 ecr 138010996], length 0
E..4.5@.@.. .........P..C.;..W9D..`........
.9...9.t
16:54:13.629974 IP host142.50936 > host142.http: Flags [P.], seq 2847436:2851532, ack 426, win 359, options [nop,nop,TS val 138011012 ecr 138011008], length 4096
E..4..@.@.b............P.W9DC.;....g.......
16:54:13.631499 IP host142.50936 > host142.http: Flags [.], seq 2851532:2917000, ack 426, win 359, options [nop,nop,TS val 138011014 ecr 138011008], length 65468
E.....@.@.r............P.WIDC.;....g.Q.....
16:54:13.632894 IP host142.50936 > host142.http: Flags [.], seq 2917000:2982468, ack 426, win 359, options [nop,nop,TS val 138011016 ecr 138011008], length 65468
E.....@.@.r............P.XI.C.;....g.Q.....
16:54:13.634434 IP host142.50936 > host142.http: Flags [.], seq 2982468:3047936, ack 426, win 359, options [nop,nop,TS val 138011018 ecr 138011008], length 65468
E.....@.@.r............P.YH.C.;....g.Q.....
16:54:13.635696 IP host142.50936 > host142.http: Flags [.], seq 3047936:3113404, ack 426, win 359, options [nop,nop,TS val 138011018 ecr 138011008], length 65468
E.....@.@.r............P.ZHxC.;....g.Q.....
16:54:13.636342 IP host142.http > host142.50936: Flags [.], ack 2917000, win 24576, options [nop,nop,TS val 138011020 ecr 138011012], length 0
E..4.6@.@............P..C.;..XI...`........
.9...9..
16:54:13.636369 IP host142.50936 > host142.http: Flags [P.], seq 3113404:3134156, ack 426, win 359, options [nop,nop,TS val 138011020 ecr 138011020], length 20752
E.QD..@.@.!............P.[H4C.;....g.......
16:54:13.636413 IP host142.http > host142.50936: Flags [.], ack 3047936, win 24576, options [nop,nop,TS val 138011020 ecr 138011016], length 0
E..4.7@.@............P..C.;..ZHx..`........
.9...9..
16:54:13.636451 IP host142.http > host142.50936: Flags [.], ack 3134156, win 24576, options [nop,nop,TS val 138011020 ecr 138011018], length 0
E..4.8@.@............P..C.;..[.D..`........
.9...9..
16:54:13.642393 IP host142.50936 > host142.http: Flags [P.], seq 3134156:3138252, ack 426, win 359, options [nop,nop,TS val 138011025 ecr 138011020], length 4096
E..4..@.@.b............P.[.DC.;....g.......
16:54:13.643536 IP host142.50936 > host142.http: Flags [.], seq 3138252:3203720, ack 426, win 359, options [nop,nop,TS val 138011027 ecr 138011020], length 65468
E.....@.@.r............P.[.DC.;....g.Q.....
16:54:13.644451 IP host142.50936 > host142.http: Flags [.], seq 3203720:3269188, ack 426, win 359, options [nop,nop,TS val 138011027 ecr 138011020], length 65468
E.....@.@.r............P.\..C.;....g.Q.....
16:54:13.645529 IP host142.50936 > host142.http: Flags [.], seq 3269188:3334656, ack 426, win 359, options [nop,nop,TS val 138011029 ecr 138011020], length 65468
E.....@.@.r............P.]..C.;....g.Q.....
16:54:13.646472 IP host142.http > host142.50936: Flags [.], ack 3334656, win 23799, options [nop,nop,TS val 138011030 ecr 138011025], length 0
E..4.9@.@............P..C.;..^.x..\........
.9...9..
16:54:13.646496 IP host142.50936 > host142.http: Flags [P.], seq 3334656:3371724, ack 426, win 359, options [nop,nop,TS val 138011030 ecr 138011030], length 37068
E.....@.@..............P.^.xC.;....g?a.....
16:54:13.655772 IP host142.50936 > host142.http: Flags [.], seq 3371724:3437192, ack 426, win 359, options [nop,nop,TS val 138011039 ecr 138011030], length 65468
E.....@.@.r............P._9DC.;....g.Q.....
16:54:13.656739 IP host142.50936 > host142.http: Flags [.], seq 3437192:3502660, ack 426, win 359, options [nop,nop,TS val 138011039 ecr 138011030], length 65468
E.....@.@.r............P.`9.C.;....g.Q.....
16:54:13.666583 IP host142.http > host142.50936: Flags [.], ack 3437192, win 24576, options [nop,nop,TS val 138011050 ecr 138011030], length 0
E..4.:@.@............P..C.;..`9...`........
.9...9..
16:54:13.666607 IP host142.50936 > host142.http: Flags [P.], seq 3502660:3523276, ack 426, win 359, options [nop,nop,TS val 138011050 ecr 138011050], length 20616
E.P...@.@."............P.a8.C.;....g.......
16:54:13.666634 IP host142.http > host142.50936: Flags [.], ack 3523276, win 24576, options [nop,nop,TS val 138011050 ecr 138011039], length 0
E..4.;@.@............P..C.;..a.D..`........
.9...9..
16:54:13.669079 IP host142.50936 > host142.http: Flags [P.], seq 3523276:3527372, ack 426, win 359, options [nop,nop,TS val 138011051 ecr 138011050], length 4096
E..4..@.@.b............P.a.DC.;....g.......
16:54:13.670144 IP host142.50936 > host142.http: Flags [.], seq 3527372:3592840, ack 426, win 359, options [nop,nop,TS val 138011051 ecr 138011050], length 65468
E.....@.@.r............P.a.DC.;....g.Q.....
16:54:13.671000 IP host142.50936 > host142.http: Flags [.], seq 3592840:3658308, ack 426, win 359, options [nop,nop,TS val 138011053 ecr 138011050], length 65468
E.....@.@.r............P.b..C.;....g.Q.....
16:54:13.671825 IP host142.50936 > host142.http: Flags [.], seq 3658308:3723776, ack 426, win 359, options [nop,nop,TS val 138011053 ecr 138011050], length 65468
E.....@.@.r............P.c..C.;....g.Q.....
16:54:13.672570 IP host142.http > host142.50936: Flags [.], ack 3592840, win 24576, options [nop,nop,TS val 138011056 ecr 138011051], length 0
E..4.<@.@............P..C.;..b....`........
.9...9..
16:54:13.672594 IP host142.50936 > host142.http: Flags [P.], seq 3723776:3760844, ack 426, win 359, options [nop,nop,TS val 138011056 ecr 138011056], length 37068
E.....@.@..............P.d.xC.;....g?a.....
16:54:13.672615 IP host142.http > host142.50936: Flags [.], ack 3723776, win 24317, options [nop,nop,TS val 138011056 ecr 138011053], length 0
E..4.=@.@............P..C.;..d.x..^........
.9...9..
16:54:13.679354 IP host142.50936 > host142.http: Flags [.], seq 3760844:3826312, ack 426, win 359, options [nop,nop,TS val 138011061 ecr 138011056], length 65468
E.....@.@.r............P.e)DC.;....g.Q.....
16:54:13.680502 IP host142.50936 > host142.http: Flags [.], seq 3826312:3891780, ack 426, win 359, options [nop,nop,TS val 138011063 ecr 138011056], length 65468
E.....@.@.r............P.f).C.;....g.Q.....
16:54:13.681479 IP host142.50936 > host142.http: Flags [.], seq 3891780:3957248, ack 426, win 359, options [nop,nop,TS val 138011063 ecr 138011056], length 65468
E.....@.@.r............P.g(.C.;....g.Q.....
16:54:13.688194 IP host142.http > host142.50936: Flags [.], ack 3826312, win 24576, options [nop,nop,TS val 138011071 ecr 138011056], length 0
E..4.>@.@............P..C.;..f)...`........
.9...9..
16:54:13.688232 IP host142.50936 > host142.http: Flags [P.], seq 3957248:3998412, ack 426, win 359, options [nop,nop,TS val 138011071 ecr 138011071], length 41164
E.....@.@..............P.h(xC.;....gOa.....
16:54:13.688269 IP host142.http > host142.50936: Flags [.], ack 3957248, win 24576, options [nop,nop,TS val 138011071 ecr 138011063], length 0
E..4.?@.@............P..C.;..h(x..`........
.9...9..
16:54:13.693463 IP host142.50936 > host142.http: Flags [.], seq 3998412:4063880, ack 426, win 359, options [nop,nop,TS val 138011075 ecr 138011071], length 65468
E.....@.@.r............P.h.DC.;....g.Q.....
16:54:13.694561 IP host142.50936 > host142.http: Flags [.], seq 4063880:4129348, ack 426, win 359, options [nop,nop,TS val 138011078 ecr 138011071], length 65468
E.....@.@.r............P.i..C.;....g.Q.....
16:54:13.695397 IP host142.50936 > host142.http: Flags [.], seq 4129348:4194816, ack 426, win 359, options [nop,nop,TS val 138011078 ecr 138011071], length 65468
E.....@.@.r............P.j..C.;....g.Q.....
16:54:13.696237 IP host142.50936 > host142.http: Flags [.], seq 4194816:4260284, ack 426, win 359, options [nop,nop,TS val 138011078 ecr 138011071], length 65468
E.....@.@.r............P.k.xC.;....g.Q.....
16:54:13.698517 IP host142.http > host142.50936: Flags [.], ack 4063880, win 24576, options [nop,nop,TS val 138011080 ecr 138011071], length 0
E..4.@@.@............P..C.;..i....`........
.9...9..
16:54:13.698546 IP host142.50936 > host142.http: Flags [P.], seq 4260284:4285132, ack 426, win 359, options [nop,nop,TS val 138011080 ecr 138011080], length 24848
E.aD..@.@..p...........P.l.4C.;....g.......
16:54:13.698592 IP host142.http > host142.50936: Flags [.], ack 4194816, win 24576, options [nop,nop,TS val 138011080 ecr 138011078], length 0
E..4.A@.@............P..C.;..k.x..`........
.9...9..
16:54:13.700989 IP host142.http > host142.50936: Flags [.], ack 4285132, win 24576, options [nop,nop,TS val 138011083 ecr 138011078], length 0
E..4.B@.@............P..C.;..m)D..`........
.9...9..
16:54:13.714022 IP host142.50936 > host142.http: Flags [P.], seq 4285132:4289228, ack 426, win 359, options [nop,nop,TS val 138011097 ecr 138011083], length 4096
E..4..@.@.b............P.m)DC.;....g.......
16:54:13.714937 IP host142.50936 > host142.http: Flags [.], seq 4289228:4354696, ack 426, win 359, options [nop,nop,TS val 138011097 ecr 138011083], length 65468
E.....@.@.r............P.m9DC.;....g.Q.....
16:54:13.715761 IP host142.50936 > host142.http: Flags [.], seq 4354696:4420164, ack 426, win 359, options [nop,nop,TS val 138011097 ecr 138011083], length 65468
E.....@.@.r............P.n9.C.;....g.Q.....
16:54:13.716848 IP host142.50936 > host142.http: Flags [.], seq 4420164:4485632, ack 426, win 359, options [nop,nop,TS val 138011099 ecr 138011083], length 65468
E.....@.@.r............P.o8.C.;....g.Q.....
16:54:13.717708 IP host142.50936 > host142.http: Flags [.], seq 4485632:4551100, ack 426, win 359, options [nop,nop,TS val 138011099 ecr 138011083], length 65468
E.....@.@.r............P.p8xC.;....g.Q.....
16:54:13.718912 IP host142.50936 > host142.http: Flags [.], seq 4551100:4616568, ack 426, win 359, options [nop,nop,TS val 138011102 ecr 138011083], length 65468
E.....@.@.r............P.q84C.;....g.Q.....
16:54:13.719737 IP host142.50936 > host142.http: Flags [.], seq 4616568:4682036, ack 426, win 359, options [nop,nop,TS val 138011102 ecr 138011083], length 65468
E.....@.@.r............P.r7.C.;....g.Q.....
16:54:13.720558 IP host142.50936 > host142.http: Flags [.], seq 4682036:4747504, ack 426, win 359, options [nop,nop,TS val 138011102 ecr 138011083], length 65468
E.....@.@.r............P.s7.C.;....g.Q.....
16:54:13.721884 IP host142.http > host142.50936: Flags [.], ack 4354696, win 24576, options [nop,nop,TS val 138011104 ecr 138011097], length 0
E..4.C@.@............P..C.;..n9...`........
.9...9..
16:54:13.721902 IP host142.50936 > host142.http: Flags [P.], seq 4747504:4760268, ack 426, win 359, options [nop,nop,TS val 138011104 ecr 138011104], length 12764
E.2...@.@.@............P.t7hC.;....g.p.....
16:54:13.748774 IP host142.50936 > host142.http: Flags [.], seq 4760268:4825736, ack 426, win 359, options [nop,nop,TS val 138011131 ecr 138011104], length 65468
E.....@.@.r............P.tiDC.;....g.Q.....
16:54:13.749628 IP host142.50936 > host142.http: Flags [.], seq 4825736:4891204, ack 426, win 359, options [nop,nop,TS val 138011131 ecr 138011104], length 65468
E.....@.@.r............P.ui.C.;....g.Q.....
16:54:13.750745 IP host142.50936 > host142.http: Flags [.], seq 4891204:4956672, ack 426, win 359, options [nop,nop,TS val 138011133 ecr 138011104], length 65468
E.....@.@.r............P.vh.C.;....g.Q.....
16:54:13.751590 IP host142.50936 > host142.http: Flags [.], seq 4956672:5022140, ack 426, win 359, options [nop,nop,TS val 138011133 ecr 138011104], length 65468
E.....@.@.r............P.whxC.;....g.Q.....
16:54:13.753468 IP host142.http > host142.50936: Flags [.], ack 4825736, win 24576, options [nop,nop,TS val 138011137 ecr 138011104], length 0
E..4.G@.@............P..C.;..ui...`........
.9...9..
16:54:13.753500 IP host142.50936 > host142.http: Flags [P.], seq 5022140:5075660, ack 426, win 359, options [nop,nop,TS val 138011137 ecr 138011137], length 53520
E..D..@.@..a...........P.xh4C.;....g.......
16:54:13.753533 IP host142.http > host142.50936: Flags [.], ack 4956672, win 24576, options [nop,nop,TS val 138011137 ecr 138011131], length 0
E..4.H@.@...........P..C.;..whx..`........
.9...9..
16:54:13.753565 IP host142.http > host142.50936: Flags [.], ack 5075660, win 24576, options [nop,nop,TS val 138011137 ecr 138011133], length 0
E..4.I@.@............P..C.;..y9D..`........
.9...9..
16:54:13.759377 IP host142.50936 > host142.http: Flags [P.], seq 5075660:5079756, ack 426, win 359, options [nop,nop,TS val 138011141 ecr 138011137], length 4096
E..4..@.@.bq...........P.y9DC.;....g.......
16:54:13.760760 IP host142.50936 > host142.http: Flags [.], seq 5079756:5145224, ack 426, win 359, options [nop,nop,TS val 138011143 ecr 138011137], length 65468
E.....@.@.r............P.yIDC.;....g.Q.....
16:54:13.761585 IP host142.50936 > host142.http: Flags [.], seq 5145224:5210692, ack 426, win 359, options [nop,nop,TS val 138011143 ecr 138011137], length 65468
E.....@.@.r............P.zI.C.;....g.Q.....
16:54:13.762286 IP host142.http > host142.50936: Flags [.], ack 5145224, win 24576, options [nop,nop,TS val 138011145 ecr 138011141], length 0
E..4.J@.@............P..C.;..zI...`........
.9.	.9..
16:54:13.762308 IP host142.50936 > host142.http: Flags [P.], seq 5210692:5239500, ack 426, win 359, options [nop,nop,TS val 138011145 ecr 138011145], length 28808
E.p...@.@..............P.{H.C.;....g.......
16:54:13.762332 IP host142.http > host142.50936: Flags [.], ack 5239500, win 24576, options [nop,nop,TS val 138011145 ecr 138011143], length 0
E..4.K@.@..
.........P..C.;..{.D..`........
.9.	.9..
16:54:13.762394 IP host142.50936 > host142.http: Flags [P.], seq 5239500:5243596, ack 426, win 359, options [nop,nop,TS val 138011145 ecr 138011145], length 4096
E..4..@.@.bm...........P.{.DC.;....g.......
16:54:13.763237 IP host142.50936 > host142.http: Flags [.], seq 5243596:5309064, ack 426, win 359, options [nop,nop,TS val 138011145 ecr 138011145], length 65468
E.....@.@.r............P.{.DC.;....g.Q.....
16:54:13.764054 IP host142.50936 > host142.http: Flags [.], seq 5309064:5374532, ack 426, win 359, options [nop,nop,TS val 138011145 ecr 138011145], length 65468
E.....@.@.r............P.|..C.;....g.Q.....
16:54:13.765168 IP host142.50936 > host142.http: Flags [.], seq 5374532:5440000, ack 426, win 359, options [nop,nop,TS val 138011148 ecr 138011145], length 65468
E.....@.@.r............P.}..C.;....g.Q.....
16:54:13.765991 IP host142.50936 > host142.http: Flags [.], seq 5440000:5505468, ack 426, win 359, options [nop,nop,TS val 138011148 ecr 138011145], length 65468
E.....@.@.r............P.~.xC.;....g.Q.....
16:54:13.767018 IP host142.50936 > host142.http: Flags [.], seq 5505468:5570936, ack 426, win 359, options [nop,nop,TS val 138011150 ecr 138011145], length 65468
E.....@.@.r............P...4C.;....g.Q.....
16:54:13.767860 IP host142.50936 > host142.http: Flags [.], seq 5570936:5636404, ack 426, win 359, options [nop,nop,TS val 138011150 ecr 138011145], length 65468
E.....@.@.r............P....C.;....g.Q.....
16:54:13.768679 IP host142.50936 > host142.http: Flags [.], seq 5636404:5701872, ack 426, win 359, options [nop,nop,TS val 138011150 ecr 138011145], length 65468
E.....@.@.r............P....C.;....g.Q.....
16:54:13.769501 IP host142.http > host142.50936: Flags [.], ack 5701872, win 22763, options [nop,nop,TS val 138011153 ecr 138011145], length 0
E..4.L@.@..	.........P..C.;....h..X........
.9...9.	
16:54:13.785383 IP host142.50936 > host142.http: Flags [.], seq 5743308:5808776, ack 426, win 359, options [nop,nop,TS val 138011167 ecr 138011153], length 65468
E.....@.@.r............P..iDC.;....g.Q.....
16:54:13.786792 IP host142.50936 > host142.http: Flags [.], seq 5808776:5874244, ack 426, win 359, options [nop,nop,TS val 138011170 ecr 138011153], length 65468
E.....@.@.r............P..i.C.;....g.Q.....
16:54:13.787896 IP host142.50936 > host142.http: Flags [.], seq 5874244:5939712, ack 426, win 359, options [nop,nop,TS val 138011170 ecr 138011153], length 65468
E.....@.@.r............P..h.C.;....g.Q.....
16:54:13.788884 IP host142.http > host142.50936: Flags [.], ack 5808776, win 24317, options [nop,nop,TS val 138011172 ecr 138011153], length 0
E..4.M@.@............P..C.;...i...^........
.9.$.9..
16:54:13.788928 IP host142.50936 > host142.http: Flags [P.], seq 5939712:5980876, ack 426, win 359, options [nop,nop,TS val 138011172 ecr 138011172], length 41164
E.....@.@..............P..hxC.;....gOa.....
16:54:13.788952 IP host142.http > host142.50936: Flags [.], ack 5939712, win 23799, options [nop,nop,TS val 138011172 ecr 138011170], length 0
E..4.N@.@............P..C.;...hx..\........
.9.$.9."
16:54:13.801841 IP host142.50936 > host142.http: Flags [.], seq 5980876:6046344, ack 426, win 359, options [nop,nop,TS val 138011184 ecr 138011172], length 65468
E.....@.@.r............P..	DC.;....g.Q.....
16:54:13.802687 IP host142.50936 > host142.http: Flags [.], seq 6046344:6111812, ack 426, win 359, options [nop,nop,TS val 138011184 ecr 138011172], length 65468
E.....@.@.r............P..	.C.;....g.Q.....
16:54:13.803751 IP host142.50936 > host142.http: Flags [.], seq 6111812:6177280, ack 426, win 359, options [nop,nop,TS val 138011187 ecr 138011172], length 65468
E.....@.@.r............P....C.;....g.Q.....
16:54:13.804585 IP host142.50936 > host142.http: Flags [.], seq 6177280:6242748, ack 426, win 359, options [nop,nop,TS val 138011187 ecr 138011172], length 65468
E.....@.@.r............P...xC.;....g.Q.....
16:54:13.805402 IP host142.50936 > host142.http: Flags [.], seq 6242748:6308216, ack 426, win 359, options [nop,nop,TS val 138011187 ecr 138011172], length 65468
E.....@.@.r............P...4C.;....g.Q.....
16:54:13.805831 IP host142.http > host142.50936: Flags [.], ack 6046344, win 24576, options [nop,nop,TS val 138011189 ecr 138011172], length 0
E..4.O@.@............P..C.;...	...`........
.9.5.9.$
16:54:13.805850 IP host142.50936 > host142.http: Flags [P.], seq 6308216:6316748, ack 426, win 359, options [nop,nop,TS val 138011189 ecr 138011189], length 8532
E.!...@.@.Q............P....C.;....g.......
16:54:13.805881 IP host142.http > host142.50936: Flags [.], ack 6177280, win 24576, options [nop,nop,TS val 138011189 ecr 138011184], length 0
E..4.P@.@............P..C.;....x..`........
.9.5.9.0
16:54:13.805911 IP host142.http > host142.50936: Flags [.], ack 6308216, win 24317, options [nop,nop,TS val 138011189 ecr 138011187], length 0
E..4.Q@.@............P..C.;.......^........
.9.5.9.3
16:54:13.814268 IP host142.50936 > host142.http: Flags [.], seq 6316748:6382216, ack 426, win 359, options [nop,nop,TS val 138011196 ecr 138011189], length 65468
E.....@.@.r............P..)DC.;....g.Q.....
16:54:13.815114 IP host142.50936 > host142.http: Flags [.], seq 6382216:6447684, ack 426, win 359, options [nop,nop,TS val 138011196 ecr 138011189], length 65468
E.....@.@.r............P..).C.;....g.Q.....
16:54:13.816473 IP host142.50936 > host142.http: Flags [.], seq 6447684:6513152, ack 426, win 359, options [nop,nop,TS val 138011199 ecr 138011189], length 65468
E.....@.@.r............P..(.C.;....g.Q.....
16:54:13.817314 IP host142.50936 > host142.http: Flags [.], seq 6513152:6578620, ack 426, win 359, options [nop,nop,TS val 138011199 ecr 138011189], length 65468
E.....@.@.r............P..(xC.;....g.Q.....
16:54:13.825566 IP host142.http > host142.50936: Flags [.], ack 6382216, win 24576, options [nop,nop,TS val 138011209 ecr 138011189], length 0
E..4.R@.@............P..C.;...)...`........
.9.I.9.5
16:54:13.825609 IP host142.50936 > host142.http: Flags [P.], seq 6578620:6603468, ack 426, win 359, options [nop,nop,TS val 138011209 ecr 138011209], length 24848
E.aD..@.@..F...........P..(4C.;....g.......
16:54:13.825664 IP host142.http > host142.50936: Flags [.], ack 6513152, win 24576, options [nop,nop,TS val 138011209 ecr 138011196], length 0
E..4.S@.@............P..C.;...(x..`........
.9.I.9.<
16:54:13.825713 IP host142.http > host142.50936: Flags [.], ack 6603468, win 24576, options [nop,nop,TS val 138011209 ecr 138011199], length 0
E..4.T@.@............P..C.;....D..`........
.9.I.9.?
16:54:13.832554 IP host142.50936 > host142.http: Flags [P.], seq 6603468:6607564, ack 426, win 359, options [nop,nop,TS val 138011216 ecr 138011209], length 4096
E..4..@.@.bU...........P...DC.;....g.......
16:54:13.833552 IP host142.50936 > host142.http: Flags [.], seq 6607564:6673032, ack 426, win 359, options [nop,nop,TS val 138011216 ecr 138011209], length 65468
E.....@.@.r............P...DC.;....g.Q.....
16:54:13.834344 IP host142.50936 > host142.http: Flags [.], seq 6673032:6738500, ack 426, win 359, options [nop,nop,TS val 138011216 ecr 138011209], length 65468
E.....@.@.r............P....C.;....g.Q.....
16:54:13.835363 IP host142.50936 > host142.http: Flags [.], seq 6738500:6803968, ack 426, win 359, options [nop,nop,TS val 138011218 ecr 138011209], length 65468
E.....@.@.r............P....C.;....g.Q.....
16:54:13.836161 IP host142.50936 > host142.http: Flags [.], seq 6803968:6869436, ack 426, win 359, options [nop,nop,TS val 138011218 ecr 138011209], length 65468
E.....@.@.r............P...xC.;....g.Q.....
16:54:13.836954 IP host142.50936 > host142.http: Flags [.], seq 6869436:6934904, ack 426, win 359, options [nop,nop,TS val 138011218 ecr 138011209], length 65468
E.....@.@.r............P...4C.;....g.Q.....
